{
  "schemaVersion": "1.0.0",
  "generatedAt": "2026-06-27T20:40:12.011Z",
  "pluginVersion": "1.0.0",
  "app": {
    "name": "Orbit Notes",
    "url": "https://orbit-notes.example",
    "category": "unknown",
    "targetUsers": [
      "researchers",
      "small teams"
    ],
    "businessModel": "freemium subscription",
    "stage": "MVP",
    "summary": "3 repository-supported feature areas detected.",
    "maturity": "early",
    "techStack": [],
    "strengths": [
      "authentication",
      "data export",
      "team workspaces"
    ],
    "weaknesses": [
      "ai recommendations",
      "email notifications",
      "enterprise sso",
      "native mobile app",
      "real time collaboration",
      "webhooks"
    ],
    "evidence": [
      {
        "type": "code",
        "path": "src/auth.ts",
        "lineStart": 1,
        "lineEnd": 1,
        "summary": "Behavioral signals for Authentication appear in this file.",
        "reliability": "high"
      },
      {
        "type": "code",
        "path": "src/export.ts",
        "lineStart": 1,
        "lineEnd": 1,
        "summary": "Behavioral signals for Data export appear in this file.",
        "reliability": "high"
      },
      {
        "type": "code",
        "path": "src/workspace.ts",
        "lineStart": 1,
        "lineEnd": 1,
        "summary": "Behavioral signals for Team workspaces appear in this file.",
        "reliability": "high"
      }
    ]
  },
  "competitors": [
    {
      "id": "nebula-desk-7bb804bd",
      "name": "Nebula Desk",
      "url": "https://nebula.example",
      "type": "direct"
    }
  ],
  "appFeatures": [
    {
      "id": "authentication-b9d90628",
      "name": "Authentication",
      "category": "Identity",
      "description": "Repository evidence indicates authentication behavior.",
      "userValue": "Users can securely access accounts.",
      "status": "partial",
      "maturityScore": 3,
      "confidence": "medium",
      "evidence": [
        {
          "type": "code",
          "path": "src/auth.ts",
          "lineStart": 1,
          "lineEnd": 1,
          "summary": "Behavioral signals for Authentication appear in this file.",
          "reliability": "high"
        }
      ],
      "relatedFiles": [
        "src/auth.ts"
      ],
      "dependencies": [],
      "qualityNotes": [
        "Coverage or completion signals are limited."
      ],
      "risks": [],
      "missingPieces": [
        "Verify the end-to-end workflow, authorization, validation, and failure states."
      ]
    },
    {
      "id": "data-export-04c82a48",
      "name": "Data export",
      "category": "Data portability",
      "description": "Repository evidence indicates data export behavior.",
      "userValue": "Users can retrieve their data.",
      "status": "partial",
      "maturityScore": 3,
      "confidence": "medium",
      "evidence": [
        {
          "type": "code",
          "path": "src/export.ts",
          "lineStart": 1,
          "lineEnd": 1,
          "summary": "Behavioral signals for Data export appear in this file.",
          "reliability": "high"
        }
      ],
      "relatedFiles": [
        "src/export.ts"
      ],
      "dependencies": [],
      "qualityNotes": [
        "Coverage or completion signals are limited."
      ],
      "risks": [],
      "missingPieces": [
        "Verify the end-to-end workflow, authorization, validation, and failure states."
      ]
    },
    {
      "id": "team-workspaces-7c911a94",
      "name": "Team workspaces",
      "category": "Collaboration",
      "description": "Repository evidence indicates team workspaces behavior.",
      "userValue": "Groups can collaborate in a shared space.",
      "status": "partial",
      "maturityScore": 3,
      "confidence": "medium",
      "evidence": [
        {
          "type": "code",
          "path": "src/workspace.ts",
          "lineStart": 1,
          "lineEnd": 1,
          "summary": "Behavioral signals for Team workspaces appear in this file.",
          "reliability": "high"
        }
      ],
      "relatedFiles": [
        "src/workspace.ts"
      ],
      "dependencies": [],
      "qualityNotes": [
        "Coverage or completion signals are limited."
      ],
      "risks": [],
      "missingPieces": [
        "Verify the end-to-end workflow, authorization, validation, and failure states."
      ]
    }
  ],
  "competitorFeatures": [
    {
      "id": "nebula-desk-7bb804bd-ai-recommendations-b74ad7bf",
      "competitorId": "nebula-desk-7bb804bd",
      "name": "AI recommendations",
      "normalizedName": "ai recommendations",
      "category": "AI",
      "description": "Evidence for AI recommendations appears in Nebula review.",
      "userWorkflow": "Not directly observed in the collected source.",
      "targetUser": "unknown",
      "availability": {
        "plan": "unknown",
        "platform": "unknown",
        "region": "unknown",
        "status": "available"
      },
      "evidenceType": "third-party-review",
      "confidence": "low",
      "maturityEstimate": "functional",
      "uxEstimate": "unknown",
      "strategicValue": "unknown",
      "tableStakes": false,
      "differentiating": false,
      "sources": [
        "https://reviews.example/nebula"
      ],
      "notes": [
        "Matched evidence near character 42."
      ]
    },
    {
      "id": "nebula-desk-7bb804bd-email-notifications-6efcb8be",
      "competitorId": "nebula-desk-7bb804bd",
      "name": "Email notifications",
      "normalizedName": "email notifications",
      "category": "Engagement",
      "description": "Evidence for Email notifications appears in Nebula marketing features.",
      "userWorkflow": "Not directly observed in the collected source.",
      "targetUser": "unknown",
      "availability": {
        "plan": "unknown",
        "platform": "unknown",
        "region": "unknown",
        "status": "claimed"
      },
      "evidenceType": "official-marketing-claim",
      "confidence": "medium",
      "maturityEstimate": "unknown",
      "uxEstimate": "unknown",
      "strategicValue": "unknown",
      "tableStakes": false,
      "differentiating": false,
      "sources": [
        "https://nebula.example/features"
      ],
      "notes": [
        "Matched evidence near character 0."
      ]
    },
    {
      "id": "nebula-desk-7bb804bd-enterprise-sso-2b718604",
      "competitorId": "nebula-desk-7bb804bd",
      "name": "Enterprise SSO",
      "normalizedName": "enterprise sso",
      "category": "Identity",
      "description": "Evidence for Enterprise SSO appears in Nebula Desk features.",
      "userWorkflow": "Not directly observed in the collected source.",
      "targetUser": "unknown",
      "availability": {
        "plan": "unknown",
        "platform": "unknown",
        "region": "unknown",
        "status": "available"
      },
      "evidenceType": "documentation-confirmed",
      "confidence": "high",
      "maturityEstimate": "functional",
      "uxEstimate": "unknown",
      "strategicValue": "unknown",
      "tableStakes": false,
      "differentiating": false,
      "sources": [
        "https://nebula.example/docs/features"
      ],
      "notes": [
        "Matched evidence near character 21."
      ]
    },
    {
      "id": "nebula-desk-7bb804bd-native-mobile-app-dc781c94",
      "competitorId": "nebula-desk-7bb804bd",
      "name": "Native mobile app",
      "normalizedName": "native mobile app",
      "category": "Mobile",
      "description": "Evidence for Native mobile app appears in Nebula review.",
      "userWorkflow": "Not directly observed in the collected source.",
      "targetUser": "unknown",
      "availability": {
        "plan": "unknown",
        "platform": "unknown",
        "region": "unknown",
        "status": "available"
      },
      "evidenceType": "third-party-review",
      "confidence": "low",
      "maturityEstimate": "functional",
      "uxEstimate": "unknown",
      "strategicValue": "unknown",
      "tableStakes": false,
      "differentiating": false,
      "sources": [
        "https://reviews.example/nebula"
      ],
      "notes": [
        "Matched evidence near character 20."
      ]
    },
    {
      "id": "nebula-desk-7bb804bd-real-time-collaboration-7a3b325b",
      "competitorId": "nebula-desk-7bb804bd",
      "name": "Real-time collaboration",
      "normalizedName": "real-time collaboration",
      "category": "Collaboration",
      "description": "Evidence for Real-time collaboration appears in Nebula Desk features.",
      "userWorkflow": "Not directly observed in the collected source.",
      "targetUser": "unknown",
      "availability": {
        "plan": "unknown",
        "platform": "unknown",
        "region": "unknown",
        "status": "available"
      },
      "evidenceType": "documentation-confirmed",
      "confidence": "high",
      "maturityEstimate": "functional",
      "uxEstimate": "unknown",
      "strategicValue": "unknown",
      "tableStakes": false,
      "differentiating": false,
      "sources": [
        "https://nebula.example/docs/features"
      ],
      "notes": [
        "Matched evidence near character 54."
      ]
    },
    {
      "id": "nebula-desk-7bb804bd-webhooks-1ae1de73",
      "competitorId": "nebula-desk-7bb804bd",
      "name": "Webhooks",
      "normalizedName": "webhooks",
      "category": "Integrations",
      "description": "Evidence for Webhooks appears in Nebula Desk features.",
      "userWorkflow": "Not directly observed in the collected source.",
      "targetUser": "unknown",
      "availability": {
        "plan": "unknown",
        "platform": "unknown",
        "region": "unknown",
        "status": "available"
      },
      "evidenceType": "documentation-confirmed",
      "confidence": "high",
      "maturityEstimate": "functional",
      "uxEstimate": "unknown",
      "strategicValue": "unknown",
      "tableStakes": false,